{
  "type": "handshake",
  "seq": 1,
  "contract": "assay-adapter/1",
  "adapter": { "id": "adapter-simulated", "version": "1.0.0" },
  "tier": "full",
  "model": { "provider": "synthetic", "model": "scripted-v1", "family": "synthetic" },
  "tool_catalog": [
    { "name": "read_file", "semantic_class": "read" },
    { "name": "write_file", "semantic_class": "write" },
    { "name": "run_command", "semantic_class": "execute" }
  ],
  "capabilities": {
    "usage_reporting": true,
    "cost_reporting": false,
    "streaming_text": true
  }
}
